{
  "$schema": "https://json-schema.org/draft/2020-12/schema",
  "$id": "https://desktopchar.local/schemas/desktop-char.tts-mcp-profile.schema.json",
  "title": "DesktopChar TTS MCP Profile",
  "type": "object",
  "additionalProperties": false,
  "properties": {
    "$schema": { "type": "string" },
    "version": { "const": 1 },
    "lifecycle": {
      "type": "object",
      "additionalProperties": false,
      "properties": {
        "type": { "enum": ["external", "managed"] },
        "start": {
          "type": "object",
          "additionalProperties": false,
          "required": ["executable"],
          "properties": {
            "executable": { "type": "string", "minLength": 1 },
            "args": { "type": "array", "items": { "type": "string" } },
            "cwd": { "type": "string", "minLength": 1 },
            "env": { "type": "object", "additionalProperties": { "type": "string" } }
          }
        },
        "startupTimeoutMs": { "type": "number", "exclusiveMinimum": 0 },
        "shutdownTimeoutMs": { "type": "number", "exclusiveMinimum": 0 },
        "healthIntervalMs": { "type": "number", "exclusiveMinimum": 0 },
        "restartOnFailure": { "type": "boolean" }
      }
    },
    "connection": {
      "type": "object",
      "additionalProperties": false,
      "properties": {
        "transport": { "const": "streamable-http" },
        "url": { "type": "string", "format": "uri" },
        "timeoutMs": { "type": "number", "exclusiveMinimum": 0 }
      }
    },
    "contract": {
      "type": "object",
      "additionalProperties": false,
      "properties": {
        "profile": { "const": "desktop-char.tts.streaming" },
        "version": { "const": 1 }
      }
    },
    "synthesis": {
      "type": "object",
      "additionalProperties": false,
      "properties": {
        "format": { "enum": ["wav", "mp3", "ogg", "opus", "pcm_s16le", "pcm_f32le"] },
        "voice": { "type": "string", "minLength": 1 },
        "rate": { "type": "number", "minimum": 0.5, "maximum": 2 }
      }
    },
    "timing": {
      "type": "object",
      "additionalProperties": false,
      "properties": {
        "fallbackCharactersPerSecond": {
          "type": "number",
          "exclusiveMinimum": 0
        }
      }
    },
    "reconnect": {
      "type": "object",
      "additionalProperties": false,
      "properties": {
        "initialDelayMs": { "type": "number", "exclusiveMinimum": 0 },
        "maximumDelayMs": { "type": "number", "exclusiveMinimum": 0 }
      }
    }
  }
}
