{
  "$schema": "../apps/desktop/public/schemas/desktop-char.tts-mcp-profile.schema.json",
  "version": 1,
  "lifecycle": {
    "type": "external",
    "healthIntervalMs": 10000
  },
  "connection": {
    "transport": "streamable-http",
    "url": "http://127.0.0.1:8766/mcp",
    "timeoutMs": 30000
  },
  "contract": {
    "profile": "desktop-char.tts.streaming",
    "version": 1
  },
  "synthesis": {
    "format": "pcm_s16le",
    "rate": 1
  },
  "timing": {
    "fallbackCharactersPerSecond": 5.56
  },
  "reconnect": {
    "initialDelayMs": 500,
    "maximumDelayMs": 10000
  }
}
